{"artifact":"spec","attempt":3,"formal_round":1,"score":95,"verdict":"REVISE","checklist":[{"id":"C1","status":"pass","evidence":"spec.md:1"},{"id":"C2","status":"pass","evidence":"spec.md:2"},{"id":"C3","status":"pass","evidence":"spec.md:3"},{"id":"C4","status":"pass","evidence":"spec.md:4"},{"id":"C5","status":"pass","evidence":"spec.md:5"},{"id":"C6","status":"pass","evidence":"spec.md:6"},{"id":"C7","status":"pass","evidence":"spec.md:7"},{"id":"C8","status":"pass","evidence":"spec.md:8"}],"blockers":["READY-02"],"findings":[{"id":"READY-02","severity":"High","description":"high issue","evidence_location":"spec.md:4","rubric_item":"C4","required_resolution":"resolve it"}],"prior_findings":[],"evidence":[{"claim":"one","location":"spec.md:1","verified":true},{"claim":"two","location":"spec.md:2","verified":true},{"claim":"three","location":"spec.md:3","verified":true},{"claim":"four","location":"spec.md:4","verified":true},{"claim":"five","location":"spec.md:5","verified":true},{"claim":"six","location":"spec.md:6","verified":true}],"required_next_action":"Resolve the finding.","artifact_digest":"aaaaaaaaaaaaaaaaaaaaaaaaaaaaaaaaaaaaaaaaaaaaaaaaaaaaaaaaaaaaaaaa","resolved_finding_ids":[]}
